[
  {
    "version": 0,
    "org_id": "0xa581bb78871a286f5e48b72433a4440c04303db610387e877d730ddb0366daab",
    "journal_id": "0x41c240366d993e0f2a4031f7177f26cb33a68f87652b51e0979dd863f21c5164",
    "period_start": 1793869200,
    "tree_size": 0,
    "root": "0x0000000000000000000000000000000000000000000000000000000000000000",
    "last_seq": 0,
    "last_hash": "0x0000000000000000000000000000000000000000000000000000000000000000",
    "checkpoint_ts": "2026-11-05T09:00:00.000Z",
    "prev_checkpoint_hash": "0x0000000000000000000000000000000000000000000000000000000000000000",
    "key_id": "rec-test-01",
    "sig": "0xbedf387fa87111fcaa249d65d1b2a63a28023024393e584c9962eb39e5e0997303d3939ab3a62e9fa9d160d2646e61edf066ee18f45789e2c3c2f1a813dc2604"
  },
  {
    "version": 0,
    "org_id": "0xa581bb78871a286f5e48b72433a4440c04303db610387e877d730ddb0366daab",
    "journal_id": "0x41c240366d993e0f2a4031f7177f26cb33a68f87652b51e0979dd863f21c5164",
    "period_start": 1793869200,
    "tree_size": 0,
    "root": "0x0000000000000000000000000000000000000000000000000000000000000000",
    "last_seq": 0,
    "last_hash": "0x0000000000000000000000000000000000000000000000000000000000000000",
    "checkpoint_ts": "2026-11-05T09:01:00.000Z",
    "prev_checkpoint_hash": "0xc69b7c56c709e31911a286ecd629482c37a30f488b220a0fe50deffff22331aa",
    "key_id": "rec-test-01",
    "sig": "0x094c6f3fddd637274ae2027d563bf40625e956212ffae11e3f2339b00539aa9eb1edc88f7bbebcf03c305c2b8d2b5759f9b09c7c319fc514c843ac38a83bb907"
  },
  {
    "version": 0,
    "org_id": "0xa581bb78871a286f5e48b72433a4440c04303db610387e877d730ddb0366daab",
    "journal_id": "0x41c240366d993e0f2a4031f7177f26cb33a68f87652b51e0979dd863f21c5164",
    "period_start": 1793869200,
    "tree_size": 0,
    "root": "0x0000000000000000000000000000000000000000000000000000000000000000",
    "last_seq": 0,
    "last_hash": "0x0000000000000000000000000000000000000000000000000000000000000000",
    "checkpoint_ts": "2026-11-05T09:02:00.000Z",
    "prev_checkpoint_hash": "0x834ae6808ef373f4e117dedeb882a505c656454213ab42f0551f936b5efbd89d",
    "key_id": "rec-test-01",
    "sig": "0x0f61159ea3807e2e6c05f0940bc4be22300867717febfcdb8cf8042d92d1e6401626d96db1d46df1ce34b93e2578d76a443b13442c36f675c4104078e9e1940c"
  },
  {
    "version": 0,
    "org_id": "0xa581bb78871a286f5e48b72433a4440c04303db610387e877d730ddb0366daab",
    "journal_id": "0x41c240366d993e0f2a4031f7177f26cb33a68f87652b51e0979dd863f21c5164",
    "period_start": 1793869200,
    "tree_size": 0,
    "root": "0x0000000000000000000000000000000000000000000000000000000000000000",
    "last_seq": 0,
    "last_hash": "0x0000000000000000000000000000000000000000000000000000000000000000",
    "checkpoint_ts": "2026-11-05T09:03:00.000Z",
    "prev_checkpoint_hash": "0xa2f67f15b446644f53b6556da498bf09790a7c0019acb73efa2c477a0e2ff5e3",
    "key_id": "rec-test-01",
    "sig": "0xde46415b74b20f907bfdc60f48687672356f7677ca565766a10822e80e994eb43c07da690a97b4245b38caa4d65ad22b7fc0096db2ee9cf09a9ac9362ad2290a"
  },
  {
    "version": 0,
    "org_id": "0xa581bb78871a286f5e48b72433a4440c04303db610387e877d730ddb0366daab",
    "journal_id": "0x41c240366d993e0f2a4031f7177f26cb33a68f87652b51e0979dd863f21c5164",
    "period_start": 1793869200,
    "tree_size": 0,
    "root": "0x0000000000000000000000000000000000000000000000000000000000000000",
    "last_seq": 0,
    "last_hash": "0x0000000000000000000000000000000000000000000000000000000000000000",
    "checkpoint_ts": "2026-11-05T09:04:00.000Z",
    "prev_checkpoint_hash": "0xb1652372ce5b680a1fcd25f6fe6098907100eb3164e536a86b355f109bee57a5",
    "key_id": "rec-test-01",
    "sig": "0xf699acbc52418538a7785cb38c8bae52494bc7c42adc02bb01ac5b17b8b21e268aeea5a17681ab7fdcc790da5001a2d76135c5e7f99333207bf35c2b3276c908"
  },
  {
    "version": 0,
    "org_id": "0xa581bb78871a286f5e48b72433a4440c04303db610387e877d730ddb0366daab",
    "journal_id": "0x41c240366d993e0f2a4031f7177f26cb33a68f87652b51e0979dd863f21c5164",
    "period_start": 1793869200,
    "tree_size": 0,
    "root": "0x0000000000000000000000000000000000000000000000000000000000000000",
    "last_seq": 0,
    "last_hash": "0x0000000000000000000000000000000000000000000000000000000000000000",
    "checkpoint_ts": "2026-11-05T09:05:00.000Z",
    "prev_checkpoint_hash": "0xbc369437e8f0aa9b9f5dcde13427fe3d1edb15b40e6b0b5f95ac9eee7be18073",
    "key_id": "rec-test-01",
    "sig": "0x0fd4929f52a5b9c377c437e1a4d9c1bdd64f145d63feccc8ef785f3e01e495ce21f68dcd6cceb6f05d7db88da115660a731b9901e9be4244527a693cf0733d02"
  },
  {
    "version": 0,
    "org_id": "0xa581bb78871a286f5e48b72433a4440c04303db610387e877d730ddb0366daab",
    "journal_id": "0x41c240366d993e0f2a4031f7177f26cb33a68f87652b51e0979dd863f21c5164",
    "period_start": 1793869200,
    "tree_size": 0,
    "root": "0x0000000000000000000000000000000000000000000000000000000000000000",
    "last_seq": 0,
    "last_hash": "0x0000000000000000000000000000000000000000000000000000000000000000",
    "checkpoint_ts": "2026-11-05T09:06:00.000Z",
    "prev_checkpoint_hash": "0x0298d9fdd094ee152a306f8117c91dae8bf5f00d78742d90e729396e2adfa5f9",
    "key_id": "rec-test-01",
    "sig": "0x87fed94f1dbd012b6cd71834f96da6bbf48befa70e1f154fe5017f7a7d664f6839a6e5ed4c8ac240dc1adfe0a8385c4b3c72b1d06a5b7c9938ab7d1829424305"
  },
  {
    "version": 0,
    "org_id": "0xa581bb78871a286f5e48b72433a4440c04303db610387e877d730ddb0366daab",
    "journal_id": "0x41c240366d993e0f2a4031f7177f26cb33a68f87652b51e0979dd863f21c5164",
    "period_start": 1793869200,
    "tree_size": 0,
    "root": "0x0000000000000000000000000000000000000000000000000000000000000000",
    "last_seq": 0,
    "last_hash": "0x0000000000000000000000000000000000000000000000000000000000000000",
    "checkpoint_ts": "2026-11-05T09:07:00.000Z",
    "prev_checkpoint_hash": "0x8bc779e62783a8c27c7112433daa2e3f18258cca4f0ed2fe1d030437dce04dd2",
    "key_id": "rec-test-01",
    "sig": "0x2b8ade4b265775a7cb3b951eacc9b61964016e4d500a437a9183c3a9c81216f461b56a7bdd3db932e69c8924c5e55ffc3a0b0c32847ed28329a005e42a5a1e05"
  },
  {
    "version": 0,
    "org_id": "0xa581bb78871a286f5e48b72433a4440c04303db610387e877d730ddb0366daab",
    "journal_id": "0x41c240366d993e0f2a4031f7177f26cb33a68f87652b51e0979dd863f21c5164",
    "period_start": 1793869200,
    "tree_size": 0,
    "root": "0x0000000000000000000000000000000000000000000000000000000000000000",
    "last_seq": 0,
    "last_hash": "0x0000000000000000000000000000000000000000000000000000000000000000",
    "checkpoint_ts": "2026-11-05T09:08:00.000Z",
    "prev_checkpoint_hash": "0xd0faed6e4cb8146c299adee8dc805ea7610225deb5d82cae524098627b0d31f9",
    "key_id": "rec-test-01",
    "sig": "0x0e1c89ec5a2b9f2ff46839c3110998614ee0ed54df171844090b116876167a9d1408e1805df47dac87e4a0225253e80bcd895b17436a335e0dbd110f5fac0a0b"
  },
  {
    "version": 0,
    "org_id": "0xa581bb78871a286f5e48b72433a4440c04303db610387e877d730ddb0366daab",
    "journal_id": "0x41c240366d993e0f2a4031f7177f26cb33a68f87652b51e0979dd863f21c5164",
    "period_start": 1793869200,
    "tree_size": 0,
    "root": "0x0000000000000000000000000000000000000000000000000000000000000000",
    "last_seq": 0,
    "last_hash": "0x0000000000000000000000000000000000000000000000000000000000000000",
    "checkpoint_ts": "2026-11-05T09:09:00.000Z",
    "prev_checkpoint_hash": "0x5b1ffc165548bc7dcb5d4b1fca5bfd79b71ab5ef09e6430a0569e85c10856a89",
    "key_id": "rec-test-01",
    "sig": "0x06b94cdd6b25f71ddf298d0ba76ada2225b3046ba021b178f5f387ac1ea6d33da503720a06b1bf0baa1a793a7a299b7c67d51926874d5bcea056192e2ff6760d"
  },
  {
    "version": 0,
    "org_id": "0xa581bb78871a286f5e48b72433a4440c04303db610387e877d730ddb0366daab",
    "journal_id": "0x41c240366d993e0f2a4031f7177f26cb33a68f87652b51e0979dd863f21c5164",
    "period_start": 1793869200,
    "tree_size": 0,
    "root": "0x0000000000000000000000000000000000000000000000000000000000000000",
    "last_seq": 0,
    "last_hash": "0x0000000000000000000000000000000000000000000000000000000000000000",
    "checkpoint_ts": "2026-11-05T09:10:00.000Z",
    "prev_checkpoint_hash": "0x74f94fec9ef0097320ebccdbe957e3ed4e41170a07b5126c6c8edbc4078be9c3",
    "key_id": "rec-test-01",
    "sig": "0x1e0f1a446515145256dc567de94662b117d94310b0a761390cd502ad8ee9ce5bc9e446dc3e079bba3746ca47fb84e45586bfaf29ee959890123b1eea142a0108"
  },
  {
    "version": 0,
    "org_id": "0xa581bb78871a286f5e48b72433a4440c04303db610387e877d730ddb0366daab",
    "journal_id": "0x41c240366d993e0f2a4031f7177f26cb33a68f87652b51e0979dd863f21c5164",
    "period_start": 1793869200,
    "tree_size": 0,
    "root": "0x0000000000000000000000000000000000000000000000000000000000000000",
    "last_seq": 0,
    "last_hash": "0x0000000000000000000000000000000000000000000000000000000000000000",
    "checkpoint_ts": "2026-11-05T09:11:00.000Z",
    "prev_checkpoint_hash": "0xb1adee6da1fb15e46331fe888a830787504b7e7a58b4721166949c088c54d7b2",
    "key_id": "rec-test-01",
    "sig": "0x15b823f92348ff39895308cf9e61c114b3a140bd2c0ae10759e97057f39c16187854dcbf526cb3bdb32a05a6df2ad05d21796c7c647195cec8a95f8a6ea91a02"
  },
  {
    "version": 0,
    "org_id": "0xa581bb78871a286f5e48b72433a4440c04303db610387e877d730ddb0366daab",
    "journal_id": "0x41c240366d993e0f2a4031f7177f26cb33a68f87652b51e0979dd863f21c5164",
    "period_start": 1793869200,
    "tree_size": 0,
    "root": "0x0000000000000000000000000000000000000000000000000000000000000000",
    "last_seq": 0,
    "last_hash": "0x0000000000000000000000000000000000000000000000000000000000000000",
    "checkpoint_ts": "2026-11-05T09:12:00.000Z",
    "prev_checkpoint_hash": "0xd90332b1d22b26a08a885effc48f97efb84ab87ffe6886c50a6981220114b3b0",
    "key_id": "rec-test-01",
    "sig": "0x063b16dc921d65f6b5b6e26b632e05d5224578346efe098f391b598a18ca979caf7563b998b4522f410017eac2ff00b1aa9d4245c5c924ac5ed95491b16a8203"
  },
  {
    "version": 0,
    "org_id": "0xa581bb78871a286f5e48b72433a4440c04303db610387e877d730ddb0366daab",